{
  "schema_version": 1,
  "locale": "ko",
  "name": "한국어",
  "common": {
    "skipCatalogue": "목록으로 건너뛰기",
    "brandHome": "Parliament Streams 홈",
    "primaryNavigation": "주 메뉴",
    "catalogueResults": "목록 검색 결과",
    "catalogueTable": "의회 방송 목록",
    "selectSource": "출처를 선택하면 관련 기록을 볼 수 있습니다.",
    "resizeDetails": "출처 상세 정보 크기 조절",
    "sortAscending": "오름차순",
    "sortDescending": "내림차순",
    "playbackError": "이 브라우저에서 재생을 시작할 수 없습니다.",
    "nav": "목록",
    "language": "언어",
    "research": "공개 조사 목록",
    "title": "의회 영상, 기록으로 남기다.",
    "lede": "전 세계 의회의 공식 영상을 찾아보세요.",
    "browse": "출처 찾아보기",
    "catalogue": "목록",
    "json": "출처 JSON 보기",
    "search": "국가, 입법기관 또는 채널 검색",
    "filters": "필터",
    "close": "출처 상세 정보 닫기",
    "catalogueCoverage": "목록 수록 현황",
    "metricSources": "출처",
    "metricPlayable": "여기서 재생 가능",
    "metricSchedules": "자동 수집 일정",
    "metricUpdated": "목록 갱신일",
    "evidenceDates": "근거 확인일",
    "notAvailable": "정보 없음",
    "principlesLabel": "공개 스트림 원칙",
    "principleDelivery": "개방형 전송",
    "principleAccess": "개방형 접근",
    "principleReuse": "개방형 재이용",
    "principleSchedules": "개방형 일정",
    "principleAccessibility": "개방형 접근성",
    "allJur": "모든 관할 지역",
    "allTypes": "모든 출처 유형",
    "source": "출처",
    "jurisdiction": "관할 지역",
    "mode": "방식",
    "format": "형식",
    "contentLanguage": "언어",
    "access": "접근",
    "use": "이용",
    "care": "이용 시 주의사항",
    "methodTitle": "기술적 접근 가능 여부와 제공자 약관은 별개의 문제입니다.",
    "methodCopy": "기록된 약관에서 제3자의 재이용을 명시적으로 금지하지 않는 한, 기술 검증을 통과한 공개 직접 스트림은 여기서 재생됩니다. 재생 버튼은 이용 허가가 아니며, 소유자는 삭제를 요청할 수 있습니다.",
    "rights": "권리 및 이용 허가 안내 읽기",
    "footer": "Parliament Streams는 독립적인 조사 목록입니다.",
    "about": "프로젝트 소개",
    "openStreams": "공개 스트림 원칙",
    "openVideoCopy": "개방형 의회 영상에는 HLS처럼 상호 운용 가능한 직접 스트림과 함께, 삽입·재송출·보존·독립적 모니터링을 허용하는 명확한 약관이 필요합니다.",
    "openStreamsCopy": "개방형 의회 영상에는 공개 일정 데이터도 필요합니다. 입법기관은 안정적인 URL에서 시의적절한 기계 판독형 프로그램·행사 정보를 제공하고, 재이용 조건·영구 식별자·시간대를 명시하며 오류를 신속히 바로잡아야 합니다.",
    "sourceType": "출처 유형",
    "sourceKind": "출처 구분",
    "accessStatus": "기술 검증",
    "stabilityRisk": "안정성 위험",
    "playbackPolicy": "시청 방식",
    "useGuidance": "재이용 및 허가",
    "availability": "이용 가능 시간",
    "accessValidatedDescription": "보관된 최신 검증에서 정상 작동이 확인되었습니다.",
    "accessNeedsReviewDescription": "기술적 접근을 검토해야 하거나 최근 확인에 문제가 있었습니다.",
    "accessLinkOnlyDescription": "직접 재생 URL이 기록되어 있지 않습니다. 공식 페이지를 이용하세요.",
    "useExplicitDescription": "기록된 출처 조건에 따라 재이용이 허용되는 것으로 보입니다.",
    "useEmbedOnlyDescription": "공식 제공자 또는 기관이 제공하는 삽입 기능만 이용하세요.",
    "useNoThirdPartyDescription": "기록된 약관에 따라 공식 사이트로 연결하거나 별도 허가를 받아야 합니다.",
    "usePersonalPendingDescription": "공개 약관만으로는 제3자 이용 허용 여부가 아직 명확하지 않습니다.",
    "useNoncommercialPendingDescription": "일부 비상업적 이용은 명시되어 있지만 전체 스트림 재생에 대해서는 확인이 더 필요합니다.",
    "attribution": "필수 출처 표시",
    "programme": "현재 프로그램 기록",
    "identity": "외부 식별 정보",
    "schedule": "일정·EPG 출처",
    "fallbacks": "공식 대체 출처",
    "fallbackEventPlatform": "행사 플랫폼",
    "fallbackLivePage": "공식 생중계 페이지",
    "fallbackYoutubeLive": "YouTube 생중계",
    "fallbackYoutubeUploads": "YouTube 업로드 영상",
    "fallbackArchive": "영상 보관소",
    "fallbackBroadcaster": "방송사",
    "fallbackLinkOut": "외부 링크",
    "fallbackProviderEmbed": "제공자 삽입 플레이어",
    "fallbackEventResolver": "행사 연결 기능 예정",
    "fallbackScheduleSource": "일정 출처",
    "fallbackNowNext": "현재·다음 프로그램 표시 가능",
    "fallbackNoSchedule": "일정 용도 없음",
    "sourcePlayable": "재생 가능",
    "sourceLinkOut": "공식 사이트 연결",
    "sourceFallback": "대체 시청",
    "sourceResearch": "시청 비활성화",
    "sourcePlayableDescription": "이 출처는 목록 안에서 직접 재생할 수 있습니다.",
    "sourceLinkOutDescription": "여기에는 플레이어가 삽입되어 있지 않습니다. 공식 사이트를 이용하세요.",
    "sourceFallbackDescription": "목록에서 공식 제공자의 삽입 플레이어나 대체 시청 페이지로 연결할 수 있습니다.",
    "sourceResearchDescription": "여기서는 시청이 활성화되어 있지 않습니다. 상세 정보에 기록된 이유와 남은 확인 사항이 있습니다.",
    "viewingFeedUnverified": "이 개별 스트림은 재생 검증을 통과하지 않았습니다.",
    "viewingSourceUnresolved": "스트림 제공자, 약관, 재생 지원 여부를 더 검토해야 합니다.",
    "latestValidation": "최근 검증",
    "validationNotRecorded": "보관된 검증 보고서가 아직 없습니다.",
    "validationChecked": "확인일 {date}",
    "validationMethod": "방법",
    "validationReport": "보고서",
    "staticHttpValidation": "정적 HTTP",
    "browserPlayerValidation": "브라우저·플레이어",
    "manifestSeedValidation": "매니페스트 기초 자료",
    "reviewFollowupValidation": "후속 검토",
    "mediaAccessibility": "미디어 접근성",
    "captions": "자막",
    "signLanguage": "수어",
    "audioDescription": "화면 해설",
    "a11yAvailable": "제공됨",
    "a11ySourceDependent": "출처·행사에 따라 다름",
    "a11yUnavailable": "제공되지 않음",
    "a11yUnknown": "아직 확인되지 않음",
    "scheduleApi": "일정 API",
    "openScheduleData": "공개 일정 데이터",
    "calendarAgenda": "달력·의사일정",
    "liveSchedulePage": "생중계 일정 페이지",
    "schedulePage": "일정 페이지",
    "officialEvidence": "공식 시청 페이지",
    "streamEvidence": "기록된 스트림 엔드포인트",
    "rightsEvidence": "권리·출처 약관",
    "privacyEvidence": "개인정보 처리방침",
    "supportingEvidence": "보충 근거",
    "viewingChecks": "시청 및 검증",
    "permissionStatus": "이용 허가 상태",
    "sourceDetails": "출처 상세 정보",
    "evidenceSources": "근거 자료.",
    "englishResearchNotes": "목록 조사 기록",
    "nowProgramme": "현재:",
    "nextProgramme": "다음:",
    "scheduleCollected": "일정 수집일 {date}",
    "reuse": "목록의 권리 요약.",
    "recommendation": "목록의 권장 사항.",
    "watch": "여기서 시청",
    "official": "공식 사이트에서 시청",
    "ready": "공식 스트림을 불러올 준비가 되었습니다",
    "disabled": "이 출처는 재생이 활성화되어 있지 않습니다",
    "optOutPlaybackPolicy": "이 공개 엔드포인트는 소유자가 삭제를 요청할 수 있는 목록 정책에 따라 재생됩니다. 이는 이용 허가가 아닙니다. 출처 안내를 확인하고 우려 사항을 알려주시면 신속히 삭제할 수 있습니다.",
    "youtubePlaybackPolicy": "제공자의 공식 개인정보 보호 강화 삽입 플레이어를 사용하며 스트림 매니페스트는 추출하지 않습니다.",
    "noResults": "필터에 맞는 목록 항목이 없습니다.",
    "noSchedule": "기록된 일정 제공 경로가 없습니다.",
    "sourceError": "목록을 불러올 수 없습니다.",
    "sourceErrorDetail": "정적 사이트는 페이지 산출물 옆의 data/channels.json 파일을 사용합니다.",
    "results": "전체 {total}개 중 {shown}개 출처",
    "documented": "기록된 출처 {count}개 · 목록 생성일 {date}",
    "labels": {
      "direct_hls": "HLS",
      "direct_dash": "DASH",
      "official_page": "공식 페이지",
      "youtube": "YouTube",
      "first_party_hls": "기관 직접 제공 HLS",
      "official_vendor_hls": "공식 업체 제공 HLS",
      "third_party_relay_hls": "제3자 중계 HLS",
      "direct_dash_research": "DASH 조사",
      "official_youtube_embed": "공식 YouTube 삽입",
      "native_playback": "직접 재생",
      "provider_embed": "제공자 삽입 플레이어",
      "link_out": "외부 링크",
      "research_only": "시청 비활성화",
      "validated": "검증됨",
      "needs_review": "검토 필요",
      "link_only": "페이지 연결만",
      "low": "낮음",
      "medium": "보통",
      "high": "높음",
      "unknown": "미확인",
      "national": "국가",
      "subnational": "지역",
      "supranational": "국제",
      "personal_use_pending_review": "불명확",
      "noncommercial_pending_review": "제한적",
      "explicit_reuse_with_conditions": "조건부 허용",
      "embed_only": "공식 삽입만",
      "no_third_party_reuse": "재이용 불가",
      "always_on": "상시",
      "sitting_only": "회의 중에만",
      "event_based": "행사별",
      "ok": "정상",
      "warning": "주의",
      "error": "오류",
      "skipped": "건너뜀"
    }
  },
  "map": {
    "section": "목록의 지리적 범위",
    "title": "수록 지역 지도",
    "lede": "공식 의회 영상 출처가 기록된 지역을 살펴보세요.",
    "jurisdictions": "관할 지역",
    "allCoverage": "전체 범위",
    "find": "관할 지역 찾기",
    "documented": "기록됨",
    "selected": "선택됨",
    "notDocumented": "아직 기록되지 않음",
    "memberCovered": "목록에 출처가 있는 회원국",
    "selectedMember": "선택한 회원국",
    "memberUndocumented": "아직 기록되지 않은 회원국",
    "boundary": "경계는 목록 탐색을 위한 것이며 영토의 지위에 대한 입장을 나타내지 않습니다.",
    "mapData": "지도 데이터",
    "coverageDetails": "수록 현황 상세",
    "selectDocumented": "기록된 국가를 선택하면 의회 영상 출처를 볼 수 있습니다.",
    "nationalSources": "국가 단위 출처",
    "noNational": "기록된 국가 단위 출처가 없습니다.",
    "subnationalCoverage": "지역 단위 수록 현황",
    "parliamentarySources": "의회 영상 출처",
    "browseComplete": "전체 목록 보기",
    "internationalCoverage": "국제기구 수록 현황",
    "membershipContext": "회원 자격 정보는 목록 수록 현황과 별도로 표시되며 영토 주권을 나타내지 않습니다.",
    "withCoverage": "목록에 출처가 있음",
    "institutionalSources": "기관 영상 출처",
    "noInstitutional": "기록된 기관 출처가 없습니다.",
    "membershipChecked": "회원 자격 확인일 {date}",
    "officialMembership": "공식 회원 자격 자료",
    "noParliamentary": "아직 기록된 의회 영상 출처가 없습니다.",
    "researchOpportunity": "이 회원국은 추가 출처 조사가 필요합니다.",
    "backOverview": "{name} 개요로 돌아가기",
    "mapUnavailable": "지도를 사용할 수 없습니다",
    "viewAll": "{name} 전체 수록 현황 보기",
    "international": "국제",
    "orgCoe": "유럽 평의회",
    "orgOsce": "유럽 안보 협력 기구",
    "orgUn": "국제연합",
    "memberState": "회원국",
    "memberStates": "회원국",
    "participatingState": "참가국",
    "participatingStates": "참가국",
    "skip": "수록 지역 지도로 건너뛰기",
    "coverageLevel": "수록 범위 단계",
    "mapLabel": "Parliament Streams 수록 지역 지도",
    "mapDescription": "의회 영상 출처가 기록된 국가와 1차 행정구역이 강조됩니다. 기록된 지역을 선택하면 상세 정보를 볼 수 있습니다.",
    "zoomControls": "지도 확대·축소 조작",
    "zoomIn": "확대",
    "zoomOut": "축소",
    "resetMap": "지도 초기화",
    "institutionLocation": "기관 위치",
    "locationOnly": "이 표시는 기관의 위치를 나타냅니다. 관할 지역의 경계를 나타내지는 않습니다.",
    "browseJurisdictions": "관할 지역 찾아보기",
    "keyboardHelp": "방향키로 지도 지역을 이름순으로 탐색하고 Enter 또는 Space로 상세 정보를 엽니다.",
    "searchHelp": "아래에서 관할 지역을 선택하세요. 검색창에서 Enter를 누르면 결과로 포커스가 이동합니다.",
    "noMatches": "일치하는 관할 지역이 없습니다."
  },
  "schedule": {
    "title": "일정",
    "lede": "목록에 기록된 의회 영상 서비스가 공개한 현재·예정 프로그램입니다.",
    "timeNote": "시간은 사용자의 현지 시간대로 표시됩니다.",
    "updated": "일정 갱신일 {date}",
    "stale": "보관된 이 일정은 12시간이 넘었습니다.",
    "guide": "편성 안내",
    "data": "일정 데이터",
    "allChannels": "모든 채널",
    "current": "현재 프로그램 정보 있음",
    "upcoming": "다음 프로그램 정보 있음",
    "channel": "채널",
    "now": "현재",
    "next": "다음",
    "actions": "작업",
    "noCurrent": "현재 프로그램 정보 없음",
    "noNext": "다음 프로그램 정보 없음",
    "results": "일정 데이터가 있는 채널 {count}개",
    "noResults": "필터에 맞는 프로그램 정보가 없습니다.",
    "skip": "편성 안내로 건너뛰기",
    "filters": "일정 필터",
    "summary": "현재·다음 정보는 프로그램과 행사 일정을 요약합니다. XMLTV에는 정확한 시간 정보가 있는 검증된 스트림만 포함됩니다.",
    "noParser": "이 지역의 자동 수집 일정은 아직 없습니다. 아래의 공식 달력을 열어보세요.",